### ISSUE TITLE
HTTP timeouts due to failed AAAA DNS lookup

### ISSUE THREAD

**Issue by scred47** [roderickvd/pleezer#52]
### Bug Description

Launching pleezer fails with error message:

```
operation timed out: error sending request for url (https://www.deezer.com/en/channels/explore/)
```

### Steps to Reproduce

1. Launch pleezer with command  `pleezer -vvv`

### Logs

```shell
[2025-01-25T22:15:25Z DEBUG pleezer] Command Args {
        secrets_file: "secrets.toml",
        name: None,
        device_type: Web,
        device: None,
        normalize_volume: false,
        initial_volume: None,
        no_interruptions: false,
        hook: None,
        quiet: false,
        verbose: 2,
        eavesdrop: false,
    }
[2025-01-25T22:15:25Z INFO  pleezer] starting pleezer/0.10.0; release
[2025-01-25T22:15:25Z INFO  pleezer] parsing secrets from secrets.toml
[2025-01-25T22:15:25Z TRACE pleezer] device uuid: 4841b8e5-ec7b-47f5-ae22-ceff4ab54f13
[2025-01-25T22:15:25Z TRACE pleezer] user agent: pleezer/0.10.0 (Rust; linux/6.6.62+rpt-rpi-v8; like Desktop; en)
[2025-01-25T22:15:25Z TRACE pleezer] client id: 447064893
[2025-01-25T22:15:25Z DEBUG pleezer::player] no bf_secret specified, fetching one from the web player
[2025-01-25T22:15:27Z ERROR pleezer] operation timed out: error sending request for url (https://www.deezer.com/en/channels/explore/)
```

### Operating System

Debian 12 (Raspberry OS)

### pleezer version

0.10.0

### Rust version (if building from source)

`rustc 1.84.0 (9fc6b4312 2025-01-07)`

### Hardware specifications

Raspberry Pi Zero 2W

### Deezer client specifications

Not relevant here

### Additional Context

I had the same problem using the moOde 9.2 preinstalled version on that device so decided to compile it on a fresh Raspberry OS Lite.

Running `tcpdump` on the wireless NIC we see that the device receives DNS response for `www.deezer.com` but tcp connection on port 80 or 443 is never initiated.

```shell
isidro@pleezer:~ $ sudo tcpdump -ni wlan0 port 80 or port 443 or port 53
tcpdump: verbose output suppressed, use -v[v]... for full protocol decode
listening on wlan0, link-type EN10MB (Ethernet), snapshot length 262144 bytes
23:15:25.809205 IP 192.168.2.187.54433 > *.*.*.*.53: 45920+ A? www.deezer.com. (32)
23:15:25.809268 IP 192.168.2.187.54433 > *.*.*.*.53: 8821+ AAAA? www.deezer.com. (32)
23:15:25.838886 IP *.*.*.*.53 > 192.168.2.187.54433: 45920 6/0/0 CNAME web.geo2.deezer.com., CNAME adn-europe.deezer.com., CNAME 
```

To rule out network problems I' ve also verified that the machine is able to reach that URL with `curl` and no problem there.

```shell
isidro@pleezer:~ $ curl https://www.deezer.com/en/channels/explore/ > /dev/null
  % Total    % Received % Xferd  Average Speed   Time    Time     Time  Current
                                 Dload  Upload   Total   Spent    Left  Speed
100  229k    0  229k    0     0  40269      0 --:--:--  0:00:05 --:--:-- 48377
```

### Due Diligence

- [x] I am using the [latest version](https://github.com/roderickvd/pleezer/releases) of pleezer
- [x] I have searched the [issues](https://github.com/roderickvd/pleezer/issues) for similar reports
- [x] I have included a full verbose log from launch to the issue, not just an excerpt
- [x] I confirm that this is an issue with pleezer, not with my system configuration or other software
- [x] I confirm that this is not a security issue, which should be [reported](https://github.com/roderickvd/pleezer/security/policy) privately
- [x] I have read and understood the [Contributing guidelines](https://github.com/roderickvd/pleezer/blob/main/CONTRIBUTING.md)

**Comment by roderickvd** [comment]
Huh, that is weird.

1. Which Rust version are you using?
2. Can you try building the latest from source?

It just so happened that I was refactoring parts of the HTTP client this evening. Long shot though.

**Comment by roderickvd** [comment]
Maybe the Zero 2W is taking more time than the configured timeouts allow.
Please try increasing `CONNECT_TIMEOUT` and `READ_TIMEOUT` in `src/http.rs` to like 60 seconds and see what happens.

**Comment by scred47** [comment]
Hi Roderick,

thank you for your quick answer.

> Huh, that is weird.
> 
>     1. Which Rust version are you using?
> 
>     2. Can you try building the latest from source?
> 
> 
> It just so happened that I was refactoring parts of the HTTP client this evening. Long shot though.

I'm using the latest stable version because I installed with rustup yesterday.

```
isidro@pleezer:~ $ rustc --version
rustc 1.84.0 (9fc6b4312 2025-01-07)
```
I installed pleezer using 

`cargo install pleezer
`



> Maybe the Zero 2W is taking more time than the configured timeouts allow. Please try increasing `CONNECT_TIMEOUT` and `READ_TIMEOUT` in `src/http.rs` to like 60 seconds and see what happens.

Thank you for your suggestion. I'll give that a try and keep you posted.

**Comment by scred47** [comment]
hi roderick,

That did the trick.

according to logs it takes about 6 seconds to go on  discovery status

```
isidro@pleezer:~ $ pleezer
[2025-01-26T12:48:05Z INFO  pleezer] starting pleezer/0.10.0.0472f06 (2025-01-26); release
[2025-01-26T12:48:05Z INFO  pleezer] parsing secrets from secrets.toml
[2025-01-26T12:48:12Z INFO  pleezer::remote] logging in with email and password
[2025-01-26T12:48:13Z INFO  pleezer::remote] ready for discovery


```

The player is now working and playing songs

**Comment by roderickvd** [comment]
Cool, I've changed the read timeout to 5 seconds. I hope that will suffice, because anything higher will be beyond the Deezer Connect reporting interval and cause disconnections.

**Comment by scred47** [comment]
Hi,

sorry to comeback. But I think I have useful information.

 I compiled  with read timeout at 5 and the issue is back 

So then I wondered why it  would take more then 5 seconds to even initiate the tcp connection. The Pi zero 2W is stil a quad core 64 bit 1Ghz ARM with 512MB from which there is plenty of free memory to run this. It shouldn' t be that slow that it can' t even inititae http in 5 seconds.

I have a feeling we are still waiting for the response of the AAAA lookup that we see in the tcpdump.

```
isidro@pleezer:~ $ sudo tcpdump -ni wlan0 port 80 or port 443 or port 53
tcpdump: verbose output suppressed, use -v[v]... for full protocol decode
listening on wlan0, link-type EN10MB (Ethernet), snapshot length 262144 bytes
23:15:25.809205 IP 192.168.2.187.54433 > *.*.*.*.53: 45920+ A? www.deezer.com. (32)
23:15:25.809268 IP 192.168.2.187.54433 > *.*.*.*.53: 8821+ AAAA? www.deezer.com. (32)
23:15:25.838886 IP *.*.*.*.53 > 192.168.2.187.54433: 45920 6/0/0 CNAME web.geo2.deezer.com., CNAME adn-europe.deezer.com., CNAME 

```

but that response is never received.

As a test, I edited /etc/resolv.conf and added 


`options no-aaaa`

After that I used the old 0.10.0 stable binary that I had backed up  and it starts consistently within 2 seconds.


```
isidro@pleezer:~ $ ./pleezertest
[2025-01-28T11:56:38Z INFO  pleezer] starting pleezer/0.10.0; release
[2025-01-28T11:56:38Z INFO  pleezer] parsing secrets from secrets.toml
[2025-01-28T11:56:40Z INFO  pleezer::remote] logging in with email and password
[2025-01-28T11:56:40Z INFO  pleezer::remote] ready for discovery
^C[2025-01-28T11:56:56Z INFO  pleezer] received Ctrl+C, shutting down
[2025-01-28T11:56:56Z INFO  pleezer] shut down gracefully
isidro@pleezer:~ $ ./pleezertest
[2025-01-28T11:56:59Z INFO  pleezer] starting pleezer/0.10.0; release
[2025-01-28T11:56:59Z INFO  pleezer] parsing secrets from secrets.toml
[2025-01-28T11:57:00Z INFO  pleezer::remote] logging in with email and password
[2025-01-28T11:57:00Z INFO  pleezer::remote] ready for discovery
^C[2025-01-28T11:57:10Z INFO  pleezer] received Ctrl+C, shutting down
[2025-01-28T11:57:10Z INFO  pleezer] shut down gracefully
isidro@pleezer:~ $ ./pleezertest
[2025-01-28T11:57:12Z INFO  pleezer] starting pleezer/0.10.0; release
[2025-01-28T11:57:12Z INFO  pleezer] parsing secrets from secrets.toml
[2025-01-28T11:57:13Z INFO  pleezer::remote] logging in with email and password
[2025-01-28T11:57:14Z INFO  pleezer::remote] ready for discovery

```

So I have a candid question, can we not have the http client skip the ipv6 name lookup instead of changing timeouts ?

**Comment by roderickvd** [comment]
> sorry to comeback. But I think I have useful information.

Don't be sorry, thanks for taking the time!
 
> So then I wondered why it would take more then 5 seconds to even initiate the tcp connection. The Pi zero 2W is stil a quad core 64 bit 1Ghz ARM with 512MB from which there is plenty of free memory to run this. It shouldn' t be that slow that it can' t even inititae http in 5 seconds.
> 
> I have a feeling we are still waiting for the response of the AAAA lookup that we see in the tcpdump.

That's really interesting. The other thought I had was that the first HTTPS request could take longer, because the SSL root certificates and crypto provider need to loaded.

> As a test, I edited /etc/resolv.conf and added
> 
> `options no-aaaa`
> 
> After that I used the old 0.10.0 stable binary that I had backed up and it starts consistently within 2 seconds.

Is the behavior any different on latest `main` or `v0.11.1`?

> So I have a candid question, can we not have the http client skip the ipv6 name lookup instead of changing timeouts ?

If you could isolate that it's indeed IPv6 and only IPv6 that's causing this (not the certificate hunch I had) then I'm thinking: yes, we can add `--ipv4` and/or `--ipv6` command-line options.

**Comment by scred47** [comment]
Hi,

I built 0.11.1 and executed when aaaa lookups are not disabled and it failed to start.

```
isidro@pleezer:~ $ pleezer
[2025-01-29T12:07:19Z INFO  pleezer] starting pleezer/0.11.1.6e6761d (2025-01-27); release
[2025-01-29T12:07:19Z INFO  pleezer] parsing secrets from secrets.toml
[2025-01-29T12:07:24Z ERROR pleezer] operation timed out: error sending request for url (https://www.deezer.com/en/channels/explore/)
isidro@pleezer:~ $ cat /etc/resolv.conf
# Generated by NetworkManager
nameserver *.*.*.*
```


the edited resolv.conf to disable aaaa lookups


```
isidro@pleezer:~ $ sudo nano /etc/resolv.conf
isidro@pleezer:~ $ cat /etc/resolv.conf
# Generated by NetworkManager
options no-aaaa
nameserver *.*.*.*
```

and now it starts fine.

```
isidro@pleezer:~ $ pleezer
[2025-01-29T12:10:41Z INFO  pleezer] starting pleezer/0.11.1.6e6761d (2025-01-27); release
[2025-01-29T12:10:41Z INFO  pleezer] parsing secrets from secrets.toml
[2025-01-29T12:10:42Z INFO  pleezer::remote] logging in with email and password
[2025-01-29T12:10:43Z INFO  pleezer::remote] ready for discovery
```

so the determining factor is the aaaa lookup.

www.deezer.com doesn't even seem to have a AAAA record at all anyways nor support ipv6 if I believe  their wikipedia page 

https://en.wikipedia.org/wiki/Deezer

or user forums

https://en.deezercommunity.com/features-feedback-44/ipv6-support-76372

**Comment by roderickvd** [comment]
Great, thanks for nailing it down.

Can you test #58? I don't have access to a multi-homed IPv4/IPv6 environment, but hope that fixes it.

If not, I'd have to implement a custom DNS resolver and pull in more dependencies. I'd like to avoid that if possible.

**Comment by scred47** [comment]
Hi Roderick,

`Can you test https://github.com/roderickvd/pleezer/pull/58? I don't have access to a multi-homed IPv4/IPv6 environment, but hope that fixes it.`

I'll check that suggestion and report back. But i did some more testing that I want to comment first.

First testing

I compiled 0.11.1 with read timeout back at 2 seconds and with the above mentioned workaround it works perfectly ( it's a great piece of software you came up with here) .

second testing

I don't have IPv6 at all in my network because of limitations on my gateway router so it is beyond me why we are querying AAAA anyways.

So I did some more testing. The raspberry OS seems to be doing AAAA lookups even when running just ping queries to a name, So it doesn't seem to be specific to  pleezer but more of an OS problem. according to manpage of resolv.conf manpage the default DNS timeout is 5 seconds.

https://www.man7.org/linux/man-pages/man5/resolv.conf.5.html

when I run 

ping google.com 

I can actually count to 5 before the first ping is even sent and you can see the timestamp between the dns lookup query and the first ping


```
11:07:41.821340 IP 192.168.2.187.57450 > pi.hole.domain: 29346+ A? google.com. (28)
11:07:41.821395 IP 192.168.2.187.57450 > pi.hole.domain: 52819+ AAAA? google.com. (28)
11:07:41.849260 IP pi.hole.domain > 192.168.2.187.57450: 29346 1/0/0 A 142.250.179.174 (44)
11:07:41.914650 IP 192.168.2.187.45426 > pi.hole.domain: 36150+ PTR? 187.2.168.192.in-addr.arpa. (44)
11:07:41.928596 IP pi.hole.domain > 192.168.2.187.45426: 36150 NXDomain* 0/0/0 (44)
11:07:41.929075 IP 192.168.2.187.48648 > pi.hole.domain: 21276+ PTR? 3.3.168.192.in-addr.arpa. (42)
11:07:41.941446 IP pi.hole.domain > 192.168.2.187.48648: 21276* 1/0/0 PTR pi.hole. (63)
11:07:46.825492 IP 192.168.2.187.57450 > pi.hole.domain: 29346+ A? google.com. (28)
11:07:46.841263 IP pi.hole.domain > 192.168.2.187.57450: 29346 1/0/0 A 142.250.179.174 (44)
11:07:46.841438 IP 192.168.2.187.57450 > pi.hole.domain: 52819+ AAAA? google.com. (28)
11:07:46.870100 IP pi.hole.domain > 192.168.2.187.57450: 52819 1/0/0 AAAA 2a00:1450:400e:802::200e (56)
11:07:46.871484 IP 192.168.2.187 > ams15s41-in-f14.1e100.net: ICMP echo request, id 6, seq 1, length 64
11:07:46.879693 IP ams15s41-in-f14.1e100.net > 192.168.2.187: ICMP echo reply, id 6, seq 1, length 64


```


So it seems to me more of a problem with how the OS is handling DNS then with pleezer itself. Unfortunately this OS is probably going to be the most used one to run Pleezer. I'm not sure which path you want to take from here. I will test the commit you mentioned and report back.

**Comment by roderickvd** [comment]
Thanks for reporting it upstream. Seems to be an `unbound` thing, and in the meantime we must find something to accommodate.
